ticket_id,category,priority,summary,suggested_action
1,Performance Issue,High,Application performance degradation leading to freezing during peak usage periods.,"Investigate application logs and server metrics during peak hours. Check for resource exhaustion (CPU, memory, database connections) and identify bottlenecks."
2,Permission Issue,High,"User is denied access to resources or functionalities following a recent promotion, indicating incorrect permission assignment.",Verify the user's new role and associated permissions. Ensure all necessary access rights are correctly provisioned for the new role.
3,Integration Issue,High,"An API endpoint is consistently returning a 500 internal server error, indicating a critical backend issue.",Review API server logs for detailed error messages. Examine recent code deployments or configuration changes that might have introduced the error.
4,Security Issue,High,User reports an unauthorized or unexpected change to their password.,Immediately lock the affected account and initiate a security investigation. Advise the user to enable MFA and change their password once access is restored securely.
5,Application Bug,Medium,"File upload functionality is failing, resulting in an unhandled exception.","Review application logs for the specific exception details. Check file storage configuration, permissions, and server-side validation logic."
6,Permission Issue,High,"A newly onboarded user has not been assigned the necessary roles, preventing them from accessing required systems or functionalities.",Verify the onboarding process and automated role assignment. Manually assign the correct roles to the user and investigate why the automated process failed.
7,Integration Issue,High,"The integration with the ERP system is experiencing timeouts, preventing data exchange or process completion.","Check network connectivity between systems, review ERP and integration middleware logs for errors, and examine timeout settings."
8,Authentication Issue,Medium,User is unable to reset their password because the generated reset link has expired.,Investigate the password reset link expiration policy. Instruct the user to request a new password reset link and try again promptly.
9,Permission Issue,High,"User reports missing permissions for specific actions or resources, preventing them from completing their tasks.",Review the user's assigned roles and their corresponding permissions. Re-assign or adjust roles as necessary.
10,Notification Issue,Medium,"Approval notifications are not being sent or received, potentially delaying critical business processes.","Check notification service logs, email server connectivity, and recipient settings. Verify the notification trigger conditions."
11,Integration Issue,High,"The synchronization process between the application and CRM system has failed, leading to inconsistent data.","Review sync job logs for errors. Check API credentials, data mapping, and network connectivity between systems."
12,Integration Issue,High,"An API endpoint is consistently returning a 500 internal server error, indicating a critical backend issue.",Review API server logs for detailed error messages. Examine recent code deployments or configuration changes that might have introduced the error.
13,Performance Issue,Medium,Search queries are taking an unusually long time to return results.,"Investigate database performance, search index status, and server resource utilization during search operations."
14,Account Access,High,User's account has been disabled without prior notice or apparent reason.,Check account status and audit logs for the reason for disablement. Re-enable the account if no malicious activity is detected and inform the user.
15,Permission Issue,High,"User reports missing permissions for specific actions or resources, preventing them from completing their tasks.",Review the user's assigned roles and their corresponding permissions. Re-assign or adjust roles as necessary.
16,Permission Issue,High,"A newly onboarded user has not been assigned the necessary roles, preventing them from accessing required systems or functionalities.",Verify the onboarding process and automated role assignment. Manually assign the correct roles to the user and investigate why the automated process failed.
17,Notification Issue,High,Push notifications are no longer being delivered to users.,"Check the status of the push notification service, review application logs for errors, and verify device token validity."
18,Integration Issue,Medium,"A configured webhook is not triggering as expected, preventing real-time updates to external systems.","Review webhook configuration, endpoint accessibility, and application logs for outgoing requests and errors."
19,Data Issue,High,Customer records are reported as missing from the system.,"Investigate recent data operations, database integrity, and potential data synchronization issues. Attempt to locate or restore the missing records."
20,Notification Issue,Medium,Automated reminder emails are not being sent or received by users.,"Check the email sending service status, cron jobs for reminders, and email logs for delivery failures."
21,Security Issue,High,The system has detected a suspicious login attempt or successful login from an unusual location or device.,"Lock the affected account, notify the user, and initiate a security investigation. Advise the user to change their password and enable MFA."
22,Permission Issue,High,"A newly onboarded user has not been assigned the necessary roles, preventing them from accessing required systems or functionalities.",Verify the onboarding process and automated role assignment. Manually assign the correct roles to the user and investigate why the automated process failed.
23,UI Issue,Low,A specific button on the user interface is unresponsive to clicks.,Inspect the front-end code for JavaScript errors or overlapping elements. Check for conditional rendering logic that might prevent interaction.
24,Notification Issue,Medium,Users are not receiving expected email alerts from the system.,"Check the email sending service status, mail server logs, and user email preferences. Verify spam folders."
25,Data Issue,Medium,"The dashboard is displaying outdated information, not reflecting recent changes or real-time data.","Investigate data refresh mechanisms, cache invalidation, and data source connectivity for the dashboard."
26,Permission Issue,High,An administrator is being denied access to the admin page or specific administrative functions.,Verify the administrator's role and associated permissions. Check for any recent changes to access control policies or user groups.
27,Performance Issue,High,High CPU utilization on the server is causing significant system lag and unresponsiveness.,"Identify the processes consuming high CPU. Optimize inefficient code, database queries, or scale up server resources."
28,Application Bug,Medium,The application crashes unexpectedly when a user attempts to open the settings menu.,Review application crash logs for stack traces. Debug the settings module for potential null pointer exceptions or unhandled errors.
29,Performance Issue,Medium,Report generation processes are experiencing excessive delays.,"Optimize database queries used for reports, review report generation logic, and consider background processing for large reports."
30,Authentication Issue,High,"User is not receiving the multi-factor authentication (MFA) code, preventing login.","Check the MFA provider status, user's registered MFA device/method, and SMS/email delivery logs."
31,Integration Issue,High,"An API endpoint is consistently returning a 500 internal server error, indicating a critical backend issue.",Review API server logs for detailed error messages. Examine recent code deployments or configuration changes that might have introduced the error.
32,Application Bug,Medium,Search functionality is returning irrelevant or incorrect results for queries.,"Investigate search indexing, query parsing, and relevance ranking algorithms. Check for data inconsistencies that might affect search."
33,UI Issue,Low,"Text elements on the dashboard are overlapping, making content difficult to read.",Inspect CSS and layout settings for the dashboard. Test on different screen resolutions and browsers to identify rendering issues.
34,Application Bug,Medium,The application crashes unexpectedly when a user attempts to open the settings menu.,Review application crash logs for stack traces. Debug the settings module for potential null pointer exceptions or unhandled errors.
35,Data Issue,Medium,Users are unable to see recent updates or changes within the application.,"Investigate caching mechanisms, database replication status, and data synchronization processes."
36,Authentication Issue,High,"SMS One-Time Password (OTP) messages are experiencing significant delays, preventing users from logging in or verifying actions.","Check the SMS gateway provider status, network connectivity, and SMS service logs for delivery issues."
37,Permission Issue,High,"A newly onboarded user has not been assigned the necessary roles, preventing them from accessing required systems or functionalities.",Verify the onboarding process and automated role assignment. Manually assign the correct roles to the user and investigate why the automated process failed.
38,Notification Issue,Medium,Users are not receiving expected email alerts from the system.,"Check the email sending service status, mail server logs, and user email preferences. Verify spam folders."
39,UI Issue,Low,A specific dropdown menu on the user interface is not expanding when clicked.,Inspect the front-end code for JavaScript errors or conflicts. Check CSS for z-index issues or hidden overflows.
40,Performance Issue,High,Application performance degradation leading to freezing during peak usage periods.,"Investigate application logs and server metrics during peak hours. Check for resource exhaustion (CPU, memory, database connections) and identify bottlenecks."
41,Integration Issue,High,"The payment gateway is failing to authenticate, preventing transactions from being processed.","Check payment gateway API credentials, network connectivity to the gateway, and review gateway specific error logs."
42,Authentication Issue,High,A user is unable to log in even after successfully resetting their password.,"Verify the user's account status, ensure the new password was correctly saved, and check for any account lockouts or MFA issues."
43,UI Issue,Low,Icons are not visible when the application is in dark mode.,"Review CSS styling for dark mode, ensuring icon colors or backgrounds contrast correctly with the dark theme."
44,Authentication Issue,Medium,User is unable to reset their password because the generated reset link has expired.,Investigate the password reset link expiration policy. Instruct the user to request a new password reset link and try again promptly.
45,Notification Issue,High,Push notifications are no longer being delivered to users.,"Check the status of the push notification service, review application logs for errors, and verify device token validity."
46,Authentication Issue,High,User's account has been locked due to multiple failed login attempts.,"Verify the user's identity, unlock the account, and advise on best practices for password management. Check for suspicious activity."
47,Permission Issue,High,"User is denied access to resources or functionalities following a recent promotion, indicating incorrect permission assignment.",Verify the user's new role and associated permissions. Ensure all necessary access rights are correctly provisioned for the new role.
48,Permission Issue,High,A manager role is unable to approve pending requests.,Verify the manager's role permissions related to approval workflows. Check for any system-wide issues affecting approval processes.
49,Permission Issue,High,An administrator is being denied access to the admin page or specific administrative functions.,Verify the administrator's role and associated permissions. Check for any recent changes to access control policies or user groups.
50,UI Issue,Medium,The application's layout is distorted or broken when viewed on mobile devices.,Debug responsive CSS and media queries. Test on various mobile devices and browsers to isolate the layout issues.
51,UI Issue,Low,A specific button on the user interface is unresponsive to clicks.,Inspect the front-end code for JavaScript errors or overlapping elements. Check for conditional rendering logic that might prevent interaction.
52,Authentication Issue,Medium,User is unable to reset their password because the generated reset link has expired.,Investigate the password reset link expiration policy. Instruct the user to request a new password reset link and try again promptly.
53,UI Issue,Medium,The application's layout is distorted or broken when viewed on mobile devices.,Debug responsive CSS and media queries. Test on various mobile devices and browsers to isolate the layout issues.
54,Authentication Issue,High,"SMS One-Time Password (OTP) messages are experiencing significant delays, preventing users from logging in or verifying actions.","Check the SMS gateway provider status, network connectivity, and SMS service logs for delivery issues."
55,UI Issue,Low,"Text elements on the dashboard are overlapping, making content difficult to read.",Inspect CSS and layout settings for the dashboard. Test on different screen resolutions and browsers to identify rendering issues.
56,Account Access,High,"A shared user account, essential for collaborative tasks, is currently inaccessible.","Verify the account credentials, check for any lockouts or security policies applied, and investigate recent changes to shared account management."
57,Authentication Issue,High,"User is not receiving the multi-factor authentication (MFA) code, preventing login.","Check the MFA provider status, user's registered MFA device/method, and SMS/email delivery logs."
58,Permission Issue,High,"A user is unable to edit specific records, indicating a lack of appropriate permissions.",Review the user's assigned roles and the permissions granted for editing these specific record types. Adjust roles or permissions as needed.
59,UI Issue,Low,"Text elements on the dashboard are overlapping, making content difficult to read.",Inspect CSS and layout settings for the dashboard. Test on different screen resolutions and browsers to identify rendering issues.
60,Permission Issue,High,"User reports missing permissions for specific actions or resources, preventing them from completing their tasks.",Review the user's assigned roles and their corresponding permissions. Re-assign or adjust roles as necessary.
